name,price,status,shipping,free_returns,items_sold
Dyson Airwrap Firm Smoothing Brush 969476-01,3500,Open Box,0,False,
"Dyson Genuine Components 1.2"" 30mm Airwrap 2 Barrels Black&Purple  PN 969467-01 ",4999,Brand New,4,True,0
New Dyson Heat Mat Airwrap,2400,Brand New,620,False,
Dyson Airwrap Complete Styler multiple hair types style Gift Case Nickel/Fuchsia,39999,Open Box,1935,False,
Dyson Airwrap Hair Styler Fuchsia Pink Nickel HS01 **MISSING 2 ATTACHMENTS**,37999,Open Box,1595,False,
LATEST Dyson NEW SOLD OUT  Complete Airwrap Long FACTORY Blue/Copper WARRANTY,59900,Brand New,2135,False,
DYSON Airwrap Presentation Case - Brown,10500,Open Box,0,False,
