name,price,status,shipping,free_returns,items_sold
Dyson Airwrap Complete Styler Set Straightener Curler All Hairstyles US standard,40800,Brand New,4,False,0
New ListingDyson Airwrap Complete Hair Styler Nickel Fuchsia Used,38000,Pre-Owned,0,False,
Dysōn Airwrap Complete Hair styler Nickel Fuchsia HS01 COMPFN COPPER 110V New,40800,Brand New,4,False,0
Dyson Quality Airwrap Styler Complete (Prussian Blue/Rich Copper) new unused,52800,Brand New,4,False,0
Dyson 310731-01 Airwrap Complete Styler - Fuchsia/Nickel,30000,Pre-Owned,2000,False,
Dyson Airwrap Complete Multi Styler - Nickel/Fuchsia,36995,Pre-Owned,1890,False,0
Dyson Airwrap Multistyler Limited Edition Prussian Blue Brand New Sealed Box,49899,Brand New,2,True,0
New ListingDyson Airwrap Complete Hair Styler HS01 Fuchsia Pink Nickel Free Fast Shipping,40200,Open Box,3,False,
Dyson HS01 Airwrap Hair Styler - Nickel/Fuschia with 4 Accessories  (IL/RT6-1...,29999,Refurbished,4,True,
New ListingDyson Airwrap - Nickel And Fuchsia Complete Styler - Used ,37400,Pre-Owned,1047,False,
"Dyson HS01 Airwrap Complete Styler Hair Styling Set, Iron/Fuchsia",25500,Open Box,973,False,
"Dys,n Airwrap Complete Styler Set Straightener Curler All Hairstyles US Standard",40800,Brand New,0,False,0
Dyson Airwrap Styler- Nickel/Fuchsia,22500,Pre-Owned,2925,False,0
Dysǒń Airwrap Complete Hair styler HS01 COMPDBBCTB Blue & Copper Special 110v,49800,Brand New,3,False,0
Dyson Airwrap Complete HS01 Hair Styler Curling Nickel Fuchsia Japan Used,34980,Pre-Owned,0,True,0
Dyson Airwrap Hair styler ( Nickel/Fuchsia ) WAND ONLY,26995,Pre-Owned,1575,False,0
New ListingDyson310731-01 Airwrap Styler Complete - Pink,37500,Open Box,1730,False,
HS01 Airwrap Complete Hair Styler Nickel Fuchsia Curling Iron 100V,40700,Brand New,0,False,0
Dyson Airwrap Volume+Shape HS01 Hair Styler Curling Nickel Fuchsia  Japan Used,30480,Pre-Owned,0,True,0
"Dyson 400714-01 Airwrap Complete Long, Nickel/Copper",36500,Brand New,973,False,
New ListingDyson Airwrap Multi-styler Complete Long HS05,34400,Brand New,2304,False,
NEW DESIGN 1.6 in Barrel Dyson Airwrap LONG 40mm Attachment Iron/Nickel - New,6499,Brand New,4,False,
Dyson Airwrap Hair Styler/ Dryer Pink/Grey - Wand & Case Only ( NO attachments ),24900,Pre-Owned,0,True,0
Dyson Airwrap Complete Hair styler Nickel Fuchsia HS01 COMPFN COPPER 110V New,40800,Brand New,0,False,0
Dyson Airwrap attachments and case Nickel and Fuscia,14900,Pre-Owned,1543,False,
New Dyson Airwrap Multi Styler Complete (Long) Special Edition Blue W/ Comb 2022,57900,Brand New,0,False,0
New ListingDyson Airwrap multi-styler Special  Gift Edition Complete Kit - Blue,55999,Brand New,2499,False,
"New ListingDyson Airwrap Complete Hair Styler Curling Nickel Fuchsia, With Extra Barrels",28500,Pre-Owned,0,False,
New ListingNew Dyson Airwrap Complete (LONG) Nickel/Fuchsia 2022 Model SEALED SHIPS ASAP 🔥,47667,Brand New,2199,False,
Dyson Airwrap Complete Hair styler Nickel Fuchsia HS01COMPFN COPPER 100V,53999,Brand New,0,True,0
HS01 Dyson Airwrap Complete Hair Styler Curling Iron 100V Used Japan,32222,Pre-Owned,0,True,0
Dyson 310731-01 Airwrap Complete Styler - Fuchsia/Nickel,40000,Pre-Owned,4365,False,
Dyson Airwrap Complete New 1.2 inch LONG Barrel - Latest Design - Nickel / Iron,9999,Brand New,0,False,0
Dyson Airwrap Complete Multi Styler - Nickel/Fuchsia US Version,36995,Pre-Owned,0,False,0
New Dyson Airwrap Complete Long.  Special Gift Edition in Vinca Blue and Rosé.,45500,Brand New,3773,False,
Dyson Airwrap Complete Storage Bag (Fuchsia/Black) - Brand New,6499,Brand New,4,False,
Dyson Airwrap Complete Styler Fuchsia - Brand New - Authentic - Fast Shipping!,40000,Brand New,3835,False,
New ListingDyson Airwrap Hair Styler/ Dryer Wand Only (No attachments) US Version 110v HS01,28000,Pre-Owned,4,False,
Dyson HS01 Airwrap Complete Hair Styler Curling Iron 100V Used Japan,31477,Pre-Owned,0,True,0
Dyson 1.6 Inch Airwrap Long Barrel - Iron/Fuschia - Right (IL/RT6-14856-96946...,2199,Refurbished,4,True,
Dyson Airwrap 1.6 long Barrel,5000,Open Box,1060,False,0
Dyson Airwrap Complete Long.  Special Gift Edition BNIB Guarantee Sephora $599,40900,Brand New,4365,False,
New ListingDyson Airwrap Nickel And Fuchsia Complete Styler - 31073101,42200,Brand New,1605,False,
"Dyson Airwrap Complete Multi-Styler with Case, Blue/Copper, HS05",35500,Open Box,973,False,
Special edition Dyson Airwrap multi-styler Long Wand With 5 Attachments HS05,44000,Pre-Owned,4,False,
NEW DESIGN SHIPS TODAY!!!!￼ Dyson Airwrap Coanda Smoothing Dryer Attachment Pink,7000,Brand New,1500,False,0
New ListingHS01 Dyson Airwrap Hair Styler/ Dryer Wand Only (No attachments)US Version 110v,28000,Pre-Owned,4,False,
DYSON AIRWRAP COMPLETE 2022 FUSCHIA/GREY FULL SET,31500,Pre-Owned,2000,False,
Dyson310731-01 Airwrap Styler Complete - Pink,46000,Brand New,4365,False,0
"Dyson Airwrap Smooth Control Styler - Pink, USED GREAT CONDITION",25200,Open Box,4365,False,
New Listingdyson airwrap complete with all tools and case bought for $580 approx used less ,45000,Pre-Owned,4365,False,
Dyson Airwrap Styler Attachments,4887,Pre-Owned,1125,False,
Dyson Airwrap Case and attachments Nickel and Copper (No Wand) Pre-owned),7500,Pre-Owned,4735,False,
Dyson 310731-02 Airwrap Complete Styler - Fuchsia/Nickel,31500,Pre-Owned,1320,False,
Dyson310731-01 Airwrap Styler Complete - Pink,22750,Pre-Owned,2195,False,
Dyson Quality Airwrap Styler Complete (Prussian Blue/Rich Copper),35000,Pre-Owned,4365,False,
Dyson Airwrap Curling Iron - Blue,29900,Pre-Owned,1500,False,
Dyson Airwrap Complete Multi Styler - Nickel/Fuchsia,27500,Pre-Owned,4999,False,
New ListingDyson Airwrap Multi Styler 120V with long barrels,22922,Pre-Owned,0,False,
Dyson Airwrap Styler - Pink,41500,Pre-Owned,924,False,
Dyson Airwrap Hs01 Hair Styler/ Dryer With (7 attachments) US Version 110v,38500,Pre-Owned,4,False,
Used Dyson Airwrap Complete Styler Straightener Curler All Hairstyles Fuchsia,28999,Pre-Owned,2245,False,
Dyson 310731-01 Airwrap Complete Styler - Fuchsia/Nickel,22250,Pre-Owned,1730,False,
Dyson 310731-01 Airwrap Complete Styler - Fuchsia/Nickel,37900,Brand New,1200,False,
New ListingDyson Airwrap Nickel And Fuchsia Complete Styler - 31073101 SRP $579,40000,Pre-Owned,5241,False,
Dyson Airwrap Curling Iron - Dark Blue and Bright Copper. Five tools in one!,36500,Open Box,1995,False,
Dyson Airwrap Multistyler Complete Long (Limited Edition),48000,Pre-Owned,3,False,
Dyson Airwrap Multi-Styler Nickel/Copper,52500,Pre-Owned,6235,False,
Dyson 310731-01 Airwrap Complete Styler - Fuchsia/Nickel,40500,Open Box,4365,False,
Dyson Airwrap Complete Smooth Control Styler BRAND NEW- Pink,36500,Brand New,6235,False,
Dyson Airwrap Complete Styler,35000,Pre-Owned,4365,False,
Dyson 1.6 Inch Airwrap Long Barrel - Iron/Fuschia - Left (IL/RT6-14855-969469...,2199,Refurbished,4,True,
Dyson Airwrap,37500,Brand New,4000,False,
Dyson Airwrap LONG Barrel New In Box 1.6 in (40mm) in Pink Nickel NEW FREE SHIP,8495,Brand New,4,True,
 HS01 Dyson Airwrap Complete Hair Styler Curling Iron 100V Used Japan,30150,Pre-Owned,0,True,0
"Dyson Airwrap Complete - Prussian Blue + Copper: In Hand, Ships ASAP SEALED🔥",47667,Brand New,2199,False,
Dyson 310731-01 Airwrap Complete Styler - Fuchsia/Nickel,40500,Open Box,4365,False,
Dyson Airwrap,37500,Brand New,4000,False,
Dyson Airwrap Complete Smooth Control Styler BRAND NEW- Pink,36500,Brand New,6235,False,
Dyson Airwrap Complete Styler,35000,Pre-Owned,4365,False,
Dyson 1.6 Inch Airwrap Long Barrel - Iron/Fuschia - Left (IL/RT6-14855-969469...,2199,Refurbished,4,True,
New ListingDyson Airwrap multi-Styler Complete Long Nickle/Copper,49500,Pre-Owned,3835,False,
New Listingdyson airwrap 1.6” barrel prussian blue,1800,Pre-Owned,700,False,
"Dyson airwrap barrels, Small And Large. 30mm Fuchsia - Lot Of 4",3500,Pre-Owned,0,False,
Dyson Airwrap Styler Display Stand (FUCHSIA) Brand New Without Box,5000,Open Box,575,False,
"Dyson  0.8 Airwrap LONG Barrels -Set of 2, Purple",6900,Brand New,0,False,
"Dyson Airwrap Complete Case with Accessories, No Styler Included.",20995,Open Box,2,False,0
NEW DESIGN SHIPS TODAY!!!!￼ Dyson Airwrap Coanda Smoothing Dryer Attachment,7500,Brand New,990,False,0
Dyson Women Curl Hair Airwrap Styler 1.2in /30mm Hair Curling Long Barrel 1 Pair,4900,Open Box,0,False,0
NEW DESIGN SHIPS TODAY Dyson Airwrap Multi Styler Complete (LONG) Nickel/Copper,41434,Brand New,2933,False,0
Dyson Airwrap Multi Styler - 40071401 (Silver),43800,Brand New,3835,False,
NEW DESIGN SHIPS TODAY  .8  Inch Long Barrel Dyson Airwrap 20 mm Attachment,6900,Brand New,0,False,0
"New ListingNever Used dyson airwrap complete prussian blue NO BOX, Soft Case All Attachment",50000,Open Box,2245,False,
Dyson Airwrap Hair Styler/ Dryer Pink/ Grey - Wand Only ( Without attachments ),23250,Refurbished,0,False,
New ListingDyson Airwrap Multi-Styler Nickel/Copper - 400714-01,55000,Pre-Owned,3835,False,
Dyson Airwrap 1300W Styler Complete Straightening Irons - 310729-01,49000,Brand New,1500,False,
Dyson HS01 Airwrap - Black/Purple,47999,Refurbished,0,True,11
Dyson Airwrap Complete Nickel/Fuchsia - Wand Only FOR PARTS REPAIR as is no cord,8900,Parts Only,599,False,0
dyson airwrap case,2500,Pre-Owned,1350,False,
Dyson Airwrap Hair Styler/ Dryer Pink/ Grey - Wand Only ( Without attachments ),26100,Refurbished,0,False,
New ListingDYSON AIRWRAP DUPE (LOOK ALIKE) FOR HAIR STYLING 5 IN 1 CURLER AND MORE,10000,Brand New,0,False,
Used Dyson Airwrap Multi Styler  (LONG) Nickel/Copper 6 Attachments No Case,48000,Pre-Owned,4,False,
Dyson Airwrap Styler Display Stand (FUCHSIA) Brand New In Box,5200,Brand New,999,False,
Dyson Large Storage Case for Airwrap Stylers - Tan (IL/RT6-14675-969776-03-TA...,3399,Refurbished,4,True,
Replacement Dyson Filter Brush for Airwrap Styler - Nickel (IL/RT6-14140-3107...,699,Refurbished,4,True,
Dyson Airwrap Special Edition - Long - Vinca Blue + Rose w/Bag + Comb - 2nd Gen,58599,Brand New,4,False,0
1.2” Long Barrels Dyson Airwrap 1.2 in/30mm Pink/Nickel - New,10828,Brand New,0,False,0
dyson airwrap multi styler,37500,Pre-Owned,4365,False,
Dyson Airwrap Complete Set with Case + EXTRAS  MINT CONDITION,39500,Pre-Owned,4500,False,
New Listingdyson airwrap smooth brush,999,Brand New,1199,False,
"Dyson HS01 Airwrap Complete Styler Hair Styling Set, Iron/Fuchsia, SEALED*",42700,Brand New,973,False,
Dyson Airwrap Complete Style for multiple hair types and styles - Black/Purpl...,39999,Refurbished,0,True,
dyson airwrap (without Styler),19900,Brand New,1710,False,0
dyson airwrap,47500,Open Box,4365,False,
1” Long Barrels Dyson Airwrap 1 in 30mm Pink/Nickel NEW OPEN BOX,11999,Open Box,4,True,
Dyson 1.6 Inch Airwrap Barrel - Iron/Fuschia - Left (IL/RT6-14298-969469-01-UA),1190,Pre-Owned,1190,False,
Dyson air wrap complete NEW,56000,Brand New,0,True,0
Dyson Airwrap Hair Styler - UK VERSION ,32500,Parts Only,2045,False,0
Dyson Airwrap Styler Complete -  310731-01 - Pink - **Read**,34299,Pre-Owned,0,True,
New ListingDyson310731-01 Airwrap Styler Complete - Pink,42000,Brand New,2195,False,
First Generation Dyson Airwrap Styler Complete + 2 New Brushes - Pink,35000,Pre-Owned,2500,False,
"Dyson Airwrap Complete Case with Accessories, No Styler Included.",21000,Pre-Owned,685,False,0
Dyson Airwrap Styler Complete - Pink,40500,Open Box,3810,False,
Dyson Airwrap Complete Large Storage Case,7999,Open Box,999,False,
New ListingDyson Airwrap Complete HS01 Hair Styler Curling Nickel Fuchsia kit,39500,Refurbished,3,False,
Dyson Airwrap Complete Styler Nickel/Fuchsia,47999,Open Box,1999,False,
dyson airwrap complete 2022,45000,Pre-Owned,4365,False,
Dyson airwrap hair styler HS01 Pre-styling dryer 969759-01 Women‘s  Hair styler,4500,Open Box,0,False,
Dyson Airwrap Complete Long Multi Styler Storage Box 1300W 110V HS05 COMP LG BNB,51000,Brand New,0,False,0
New ListingDyson Airwrap Multi Styler Complete Nickel 2022 100V 1200W HS05,49900,Brand New,0,False,
Dyson Airwrap Complete Styler multiple hair types style Gift Case Nickel/Fuchsia,42000,Open Box,0,False,0
Dyson Airwrap Hair Styler/ Dryer Wand Only (No attachments) US Version 110v HS05,34000,Pre-Owned,4,False,
Dyson Airwrap Attachments (Used) - No wand included,20000,Pre-Owned,6235,False,
Dyson Airwrap Complete Styler Set Straightener Curler All Hairstyles US standard,37500,Pre-Owned,4365,False,
USA Dyson Airwrap Complete Edition in Red/Nickel,38500,Open Box,2500,False,
Dyson Airwrap Shelf And Rack,1199,Brand New,0,False,
Dyson Airwrap Hair Styler,32500,Pre-Owned,2399,False,
Dyson Airwrap Complete Styler Multi-Styler Complete Vinca Blue/Rose 100v NEW,51000,Brand New,0,True,
Dyson Airwrap Complete HS01 Hair Styler with  case / 100V /Color Variations G455,59950,Brand New,2400,False,
NEW DESIGN SHIPS TODAY LONG 1.6 mm Barrel Dyson Airwrap 40mm Attachment,6500,Brand New,1500,False,31
Dyson Airwrap Complete Multi Styler Nickel/Copper w/Storage Box 100V Used,49000,Open Box,0,True,
New ListingDyson Airwrap Styler Volume+Shape Curl Dryer HS01VNSFN Nickel Fuchsia 100v Fedex,41399,Brand New,0,True,
NEW DESIGN SHIPS TODAY  .8  Inch Long Barrel Dyson Airwrap 20 mm Attachment,6000,Brand New,895,False,49
Dyson Airwrap Special Limited Edition Multi-Styler Complete Long Vinca Blue/Rosé,69900,Brand New,0,False,
Dyson Airwrap Direct sales limited Genuine Components Travel Pouch Black/Fuchsia,3500,Brand New,3400,True,0
dyson airwrap,47500,Open Box,4365,False,
Dyson Airwrap Complete HS01 Hair Styler with  case / 100V /Color Variations G455,59950,Brand New,2400,False,
NEW DESIGN SHIPS TODAY LONG 1.6 mm Barrel Dyson Airwrap 40mm Attachment,6500,Brand New,1500,False,31
Dyson dyson airwrap Styler N,39999,Pre-Owned,0,True,0
Used Dyson Airwrap Multi Styler Complete (LONG) Nickel/Copper (See Pics) No Case,57500,Pre-Owned,4,False,
Dyson HS05 Airwrap Styler Complete Long in Vinca-Blue-Rose Special Edition,59999,Refurbished,0,True,
Dyson Airwrap Complete Hair styler Nickel Fuchsia HS01 100V COMPFN COPPER Used,31998,Pre-Owned,0,False,0
1.2” Long Barrels Dyson Airwrap 1.2 in/30mm Pink/Nickel - New,10828,Brand New,0,False,0
New Dyson Airwrap Multi Styler Complete (NORMAL) Nickel/Copper - 2022 Model,79900,Brand New,4,True,0
NEW DESIGN SHIPS TODAY  .8  Inch Long Barrel Dyson Airwrap 20 mm Attachment,6800,Brand New,1000,False,0
Dyson Airwrap HS01 Hair Styler Volume Shape Pink fuchsia ladies iron dryer F/S,36700,Pre-Owned,0,True,0
Dyson - Airwrap Complete Styler - RARE FUCHSIA/NICKEL FAST  FREE SHIPPING USA!!,69888,Brand New,4,False,0
Dyson Airwrap Complete Styler Hair Styling Set Fuschia Great Working 100% HS01,35999,Pre-Owned,0,True,0
Dyson airwrap portable pouch ONLY Direct sales limited heat resistant in Box,3799,Brand New,0,True,0
Dyson  Airwrap HS01 Complete Styler -Fuchsia -With Case,40999,Pre-Owned,4,False,
Dyson Airwrap 1.6 inch 40mm Airwrap™ Barrels Look Unused,7000,Brand New,585,False,
Dyson Airwrap 30MM 1.2 inch barrels (2) Black/Purple 969467-01 Factory Sealed ,4999,Brand New,0,False,
Dyson Airwrap  Hair Styling Set Fuschia Great Working 100% dyson HS01 VNS FN,32800,Pre-Owned,0,True,
Dyson Airwrap Volume+Shape HS01 Hair Styler Curling set Japan Used,40000,Pre-Owned,0,True,0
Dyson Airwrap Small Smoothing Brush (Black/Purple) NEW,4399,Brand New,899,False,
"GENUINE Dyson Airwrap Barrel Long 40mm Attachments 1.6"" Fuchsia Iron 970290-01",9000,Brand New,3,True,
New Listingdyson airwrap complete vinca blue and rose,55000,Brand New,4365,False,
Dyson Airwrap Complete Hair Styler w/Extras; Used Twice,50000,Pre-Owned,3545,False,
Dyson Airwrap Hair Styler HS01 HS05 Pre-styling Dryer Nozzle 969759-03,4500,Open Box,0,False,
New Dyson Airwrap Multi Styler Complete (LONG)Fuchsia/Nickel-2022 Model-8pc+Case,57999,Brand New,0,False,0
Dyson Airwrap Prussian Blue Presentation- Case Only,5800,Pre-Owned,1899,False,
Dyson Airwrap Complete HS01 Hair Styler Curling Iron 100V New,50900,Brand New,0,True,16
Dyson Airwrap Complete Styler Set Straightener Curler US **RARELY USED**,39999,Pre-Owned,3984,False,
New Dyson Airwrap Styler Volume&Shape Curl Hair Dryer Hair Wave Styling Set 220V,85098,Brand New,0,False,
Dyson Airwrap Multistyler Complete Long HS05 2022 AC 100Vspecification 1200W,63990,Brand New,0,False,0
dyson airwrap multi styler,50000,Pre-Owned,4365,False,
Dyson310731-01 Airwrap Styler Complete - Pink,50000,Open Box,4365,False,
Dyson Airwrap multi-styler Complete Long - Vinca Blue/Rosé Mint,54785,Pre-Owned,1440,False,
Dyson Airwrap 1.2” /30mm barrels Prussian Blue - Used Once,2100,Pre-Owned,1260,False,
Dyson Airwrap Nickel Fuchsia Never used!,39999,Open Box,4365,False,
Dyson Airwrap Styler Set Of 7 Attachments,25000,Pre-Owned,2500,False,
DYSON AIRWRAP STYLER COMPLETE PINK,40000,Pre-Owned,4030,False,
SHIPS TODAY NEW DESIGN LONG 1.2 mm Barrel  Dyson Airwrap 30 mm Attachment NWT,12500,Brand New,1500,False,0
Dyson Airwrap Multi Styler Long Nickel/Fuchsia 2022 NEW 220V (Korean Ver.),79900,Brand New,0,False,
Dyson Airwrap Generation One Short Barrel Attachment Set Of 4,12000,Pre-Owned,1190,False,
Dyson Airwrap HS01 Hair Styler Complete 4variations Japan dark blue / fucia pink,52888,Brand New,0,True,8
Dyson Airwrap Complete long Multi Styler Storage Box 100V 1200W H113,58900,Brand New,4500,False,
Dyson Airwrap Attachments ONLY Accessories 5 pieces Brushes Barrels Filter Clean,10999,Pre-Owned,1115,False,
Dyson airwrap portable pouch ONLY Direct sales limited heat resistant in Box B/P,3799,Brand New,0,True,0
Dyson Airwrap Complete HS01 COMP DBBC TB Dark Blue Copper Hair Iron Curl Japan ,48700,Brand New,0,True,0
EU Power Cable Cord  for Dyson Airwrap styler HS01 220V Euro plug curling iron,4885,Brand New,0,False,
Dyson310731-01 Airwrap Styler Complete - Pink,37500,Pre-Owned,5786,False,
Dyson Airwrap Complete Styler Hair Styling Set Copper Great Working 100% HS01,44900,Pre-Owned,4,False,0
Dyson Airwrap Complete Styler - Black/Purple Missing Parts.,47250,Open Box,0,False,
Dyson Airwrap Complete Styler  for Multiple Hair Types and Styles Fuchsia,44998,Pre-Owned,3,False,
Dyson Airwrap Complete Prussian Blue Rich Copper 2022 new model SOLD OUT!,79500,Brand New,1580,False,
Dyson Airwrap Round Volumizing Brush Attachment in Fuchsia,7500,Pre-Owned,545,False,
Dyson Airwrap Multi Styler Complete LONG Special Edition 2022 Model,70999,Brand New,4,True,0
New Dyson Airwrap Multi Styler Complete (LONG) Fuchsia  - 2022 Model,69900,Brand New,4,False,0
SEALED NEW DYSON AIRWRAP BARRELS BLACK PURPLE 1.2”   30mm,10999,Brand New,899,False,
Dyson HS01COMPFN Airwrap Complete Dyson Nickel Fusha New F/S FedEx/DHL,50355,Brand New,0,False,0
Dyson Womens Airwrap Rack H Plus ,5555,Open Box,4,True,0
Dyson - Airwrap Complete Styler CASE ONLY Empty,7999,Pre-Owned,4,False,
Dyson Airwrap Complete Nickel/Fuchsia,65000,Pre-Owned,3835,False,
New Dyson Airwrap Complete HS01 Hair Styler Limited Color Silver/ Copper 100V,47900,Brand New,0,True,
Dyson Airwrap Complete Black Purple Hair Styling Supplies Hair Dryer 1200W,64999,Pre-Owned,2500,True,
Dyson Airwrap Complete Storage Bag (Fuchsia/Black) Part # 971074-01 - Brand New,5285,Brand New,1115,False,
Special Edition Dyson Airwrap Multi-Styler Complete Long Vinca Blue/Rosé NIB,74995,Brand New,0,False,
Dyson Airwrap Complete (Black/Purple)[HS01 COMP PB] Pre-Owned,42900,Pre-Owned,0,True,
"Ostay Air Dock, Holder & Storage of Styling Tools for Dyson Hair Styler Airwrap",2999,Open Box,1029,False,
Dyson Air wrap Complete Hair styler HS01COMPDBBCTB Blue & Copper Special 100v,53800,Open Box,0,True,0
Dyson Airwrap Multi Styler Complete LONG Special Edition 2022 Model,59998,Pre-Owned,3,False,
Dyson Airwrap Travel Pouch - Black/Rose,9000,Brand New,4,False,
Dyson Airwrap Nickel And Fuchsia Complete Styler - 31073101,54900,Brand New,1697,False,
Dyson Airwrap Travel Pouch - Black/Rose,9000,Brand New,4,False,
Dyson Airwrap Nickel And Fuchsia Complete Styler - 31073101,54900,Brand New,1697,False,
New Sealed Dyson Airwrap Multi Styler Complete (LONG) Nickel/Copper - 2022 Model,87999,Brand New,0,False,
New Dyson Airwrap Multi Styler Complete (Long) Special Edition Blue W/ Comb 2022,74994,Brand New,3,True,
NEW DESIGN 1.2 mm Barrel Dyson Airwrap 30 mm Attachment Iron/Nickel NEW IN BOX,5500,Brand New,1500,False,0
Dyson Airwrap Complete  Hair Styler Curling Nickel Fuchsia HS01 Used,34000,Pre-Owned,0,True,0
Dyson HS01 Airwrap Hair Styler - Red/Silver with 4 Accessories  (IL/RT6-15487...,29999,Refurbished,4,True,
Dyson 0.8 inch Long Airwrap barrel - Black/Purple - Left (IL/RT6-15986-08INCH...,1999,Refurbished,4,True,
Dyson Airwrap Multi Styler Complete Nickel/Copper 1200w 100V 2022 NEW,54500,Brand New,0,True,0
"SINGLE Dyson Airwrap Barrel Long 40mm Attachment 1.6"" Fuchsia Iron 970290-01",5800,Open Box,3,True,
Dyson HS01 VNSFN Hair Styler Pink Color Variations Airwrap Complete w/ case,34189,Pre-Owned,0,True,0
Dyson airwrap hair styler Small Round volumizing brush 970739-1  curly hair,3500,Pre-Owned,0,False,
NEW / Dyson Airwrap Complete - Nickle/Fuchsia,49999,Open Box,0,False,
"Dyson Airwrap Complete Styler set, Nickel Fuchsia",54599,Open Box,0,False,
Dyson Airwrap Complete hair styler HS01 COMP from Japan,42000,Pre-Owned,2500,False,
1 Pairs Dyson Women Curl Hair Airwrap Styler 1.2in/30mm Long Barrel,4790,Open Box,129,False,
SEALED NEW DYSON AIRWRAP BARRELS BLACK PURPLE 1.2”   30mm,10999,Brand New,899,False,
 Dyson Airwrap Hair Styler HS01 tested 100V Japan Import,38998,Pre-Owned,0,True,0
Dyson Airwrap Styler Fuchsia/Nickel,42500,Pre-Owned,1496,False,
"Ostay Air Dock, Holder & Storage of Styling Tools for Dyson Hair Styler Airwrap",2999,Open Box,1029,False,
Dyson Airwrap Multi Styler Complete (LONG) Fuchsia/Nickel ￼- Newest Model USA!,77788,Brand New,4,False,0
 Dyson Airwrap Complete Hair  Styler Set (HS01) IRON/FUCHSIA,44999,Refurbished,0,True,0
Brand New Dyson Airwrap Multi Styler Complete (LONG) Nickel/Copper - 2022 Model,82900,Brand New,4,True,0
"Wood & Metal Storage Holder for Dyson Airwrap, Curling Iron Holder for Dyson Air",3660,Brand New,0,True,
Dyson Airwrap Complete Long Fucshia Silver 2022 new model,55000,Pre-Owned,1580,False,
NEW DESIGN SHIPS TODAY Dyson Airwrap Soft Smoothing Brush Attachment Ships Today,5500,Brand New,1500,False,0
Dyson Airwrap,35000,Pre-Owned,1697,False,
Dyson Airwrap Hair Styler ONLY (Black/Nickel) NEW,47920,Brand New,1999,False,
Brand New - Dyson Airwrap Complete Styler Fuchsia Nickel - FREE SHIPPING OEM,70000,Open Box,4,False,
1 Pair Dyson Women Curl Hair Airwrap Styler Hair Curling Long Barrel 1.2in /30mm,4760,Brand New,0,False,
Dyson Airwrap Volume+Shape HS01 Nickel/Fuchsia Styler Iron 100V ,54899,Brand New,0,True,0
Dyson Airwrap Complete Hair styler Nickel Fuchsia HS01COMPFN COPPER 100VV JAPAN,58049,Brand New,0,True,
Dyson Women Curl Hair Airwrap Styler 1.2in/30mm Long Barrel,5995,Open Box,0,False,
Dyson310731-01 Airwrap Styler Complete - Pink,50000,Pre-Owned,4365,False,
Dyson Airwrap Complete Multi Styler - Nickel/Fuchsia US Version,69995,Pre-Owned,1890,False,
Dyson Airwrap Barrells 30mm AND 40mm purple.  SHORT BARRELLS. FREE SHIPPING,20000,Brand New,0,False,
PREOWNED DYSON AIR WRAP RED CASE WITH ACCESSORY PAD,3999,Pre-Owned,899,False,
Dyson Airwrap Volume+Shape HS01 Long Hair Styler Iron,41399,Brand New,0,True,
DYSON Airwrap Presentation Case - Black,10000,Open Box,0,False,
New Dyson Airwrap Styler Volume&Shape Curl Hair Dryer Hair Wave Styling Set 220V,85120,Brand New,0,False,
Dyson Airwrap Complete Hair styler Nickel Red HS01COMPRNNM COPPER 100V,55299,Brand New,0,True,0
Dyson Airwrap Complete Styler Set Straightener Curler All Hairstyles $599,49900,Open Box,1695,True,
Dyson Genuine Airwrap Filter Cover from Airwrap Hair Styler HS01 Filter Cap,5425,Open Box,0,False,
Dyson Airwrap Pouch ONLY New in Box DHLEXP,4980,Brand New,0,True,0
New ListingOperating Instruction Manual Booklet for Dyson Airwrap  English and Spanish ,300,Brand New,439,False,
New ListingDyson Airwrap Multistyler 1.6 Inch 40 mm Long Barrel Attachment New 2022 Design,6900,Brand New,1299,False,
Dyson Airwrap Multi Styler Complete (LONG) Nickel/Copper - 2022 Model (Newest)!!,61000,Brand New,990,False,
New ListingDyson HS01 VNS FN Air Wrap Dryer Thin curler brush hair styler color Pink Japan,33000,Pre-Owned,2000,False,
New ListingDyson Airwrap Hair Styler Dryer 100V Japan Version HS01 MINT,27000,Pre-Owned,0,True,
"Ostay Air Dock, Holder & Storage of Styling Tools for Dyson Hair Styler Airwrap",4999,Open Box,1499,False,
Dyson AirWrap Hair Styler HS01 VNS FN Pink Attachments & Case 100V FedEx / DHL,33201,Pre-Owned,0,True,0
Dyson Large Storage Case for Airwrap Stylers - Tan (IL/RT6-14675-969776-03-TA...,2400,Pre-Owned,1250,False,
Dyson Large Storage Case for Airwrap Stylers - Tan,3500,Pre-Owned,2635,False,
Dyson airwrap styler HS01 Small Round volumizing brush 970739-1 curly hair,4200,Brand New,0,False,
New ListingDyson Airwrap Complete long Multi Styler Storage Box 1300W 110V HS05 COMP LG BNB,46500,Pre-Owned,0,True,
Dyson Airwrap Styler Volume + Shape Curl Dryer HS01 (100V) Japan Used F/S,35145,Pre-Owned,0,True,0
SEALED NEW DYSON AIRWRAP LONG BARRELS BLACK PURPLE 1.2 long 30mm,10999,Brand New,899,False,
Dyson - Airwrap Complete Styler Fuchsia Complete Set- Sealed in Box,71499,Brand New,2,False,0
Dyson Airwrap,44900,Pre-Owned,1505,False,
Dyson310731-01 Airwrap Styler Complete - Pink,37500,Pre-Owned,2500,False,
Dyson Airwrap Multi-Hair Styler Kit [HS01] With Storage Case Dryer Brush Styling,44677,Pre-Owned,8251,False,
New Dyson Airwrap Complete Long,82500,Open Box,2000,False,
Dyson Airwrap Complete Hair Styler Exclusive Limited Nickel/Red Color 100V1200W,49999,Open Box,0,True,0
New Dyson Airwrap Complete Hair Styler Fuchsia Pink All Accessories Included,44999,Open Box,5187,False,
Dyson Large Storage Case For Airwrap Stylers Curler Tan Travel Air Wrap Leather,3000,Pre-Owned,2500,False,
Dyson HS05 Airwrap Styler Complete Long in Vinca-Blue-Rose Special Edition,67999,Open Box,0,True,
Dyson Airwrap 100V 1200W HS05,49980,Brand New,0,True,
Dyson HS01 Airwrap Complete Styler Set LIMITED EDITION - RED/BRIGHT NICKEL - NEW,89900,Brand New,0,True,
