name,price,status,shipping,free_returns,items_sold
Atlas of World History,500,Pre-Owned,0,True,
Reader's Digest World Atlas - Hardcover By Reader's Digest - GOOD,439,Pre-Owned,0,True,
Readers Digest atlas of the world,519,Pre-Owned,0,False,
Encyclopedic World Atlas by George Philip & Son; Oxford University Press,700,Pre-Owned,0,True,
Rand McNally Goode's World Atlas by ,549,Pre-Owned,0,False,
1967 Hardcover Hammond Contemporary World Atlas ~ Incredible Condition,225,Pre-Owned,0,False,
The World Atlas of Birds by Various Book The Fast Free Shipping,765,Pre-Owned,0,True,
Reader's Digest Atlas of the World by Editor Book The Fast Free Shipping,506,Pre-Owned,0,True,
Atlas of World History,459,Pre-Owned,0,False,
The Harper Atlas of World History,499,Pre-Owned,0,False,
Atlas of World Geography,305,Pre-Owned,0,False,0
Collins World Atlas: Illustrated Edition by Collins Maps Book The Fast Free,772,Pre-Owned,0,False,
The World Atlas of Coffee: From Beans to Brewing -- *2ND EDITION*,1299,Brand New,400,False,0
"New ListingReader's Digest Wide World Atlas - hardcover, 0528831488, Association",628,Pre-Owned,0,False,
New ListingGoodes World Atlas (22nd Edition),682,Pre-Owned,0,True,
The Reader's Digest Children's Atlas of The World   (Third Edition) - GOOD,428,Pre-Owned,0,True,
"The World Atlas of Street Art and Graffiti by Fekner, John Book The Fast Free",897,Pre-Owned,0,False,
Philip's World Atlas(540063916) Book The Fast Free Shipping,350,Pre-Owned,0,False,
Essential World Atlas (Eighth Edition) - Paperback By DK Publishing - VERY GOOD,409,Pre-Owned,0,True,
"New ListingBook ""The Eyewitness Atlas of the World"" Newsweek 1994",387,Pre-Owned,416,False,
"Children's Illustrated Atlas of the World (Rand McNally,  - VERY GOOD",428,Pre-Owned,0,True,
The Times Atlas of World History,599,Pre-Owned,0,False,
Atlas of the World: Twenty-Eighth Edition (Hardback or Cased Book),4499,Brand New,1395,False,
New ListingRand McNally World Atlas 1992 Traveling Vintage Printed in USA,1500,Pre-Owned,0,False,
"New ListingThe Usborne World Atlas of Dinosaurs - Hardcover By Davidson, Susanna - GOOD",439,Pre-Owned,0,True,
Encyclopedic World Atlas,419,Pre-Owned,0,False,
National Geographic Collegiate Atlas of the World,550,Pre-Owned,0,False,
Goodes World Atlas,446,Pre-Owned,0,False,
Reader's Digest Atlas of the World by Reader's Digest,600,Pre-Owned,0,True,
Atlas of the World Hardcover,1347,Pre-Owned,0,False,
Longman Atlas Sixth Edition by Malcolm Stacey Hardback FREE POSTAGE,1246,Pre-Owned,2077,False,
National Geographic Atlas of the World Third Edition (1970) Hardcover w/ Sleeve,5000,Pre-Owned,1031,False,
The Fun World Atlas,544,Pre-Owned,0,False,
"New ListingThe Great World Atlas by Dorling Kindersley Publishing Staff (2006, Hardcover) ",2200,Pre-Owned,1311,False,
"National Geographic Concise Atlas of the World, Third Edition: The Ultimate Com",2098,Brand New,0,False,
New ListingThe New Webster's U. S. & World Atlas 1982 Hardcover,600,Pre-Owned,,False,
"New ListingNational Geographic Concise Atlas of the World, 4th Edition: The Ultimate Compac",1466,Pre-Owned,0,False,0
Webster's 21th Century World Atlas Editors AND Cartographic Hardcover Book,699,Pre-Owned,,False,
The Penguin Atlas of Women in the World ,1066,Pre-Owned,349,False,
Atlas Of The World Kieth Lye Philip Steele Starry Dog Books 2005 Hardcover Book,598,Pre-Owned,416,False,
Geographica World Atlas & Encyclopedia by Langenscheidt,500,Pre-Owned,0,True,
"New ListingNational Geographic Concise Atlas of the World, Third Edition: The Ultimate Comp",618,Pre-Owned,,True,
"Reader's Digest atlas of the world - 0895772647, hardcover, Joseph L Gardner",510,Pre-Owned,0,False,
"Reader's Digest atlas of the world - 0895772647, hardcover, Joseph L Gardner",515,Pre-Owned,0,False,
"Atlas Goode's World Atlas by Rand McNally Staff (2006, Map, Other)",704,Pre-Owned,550,False,
Collins World Atlas  Illustrated Edition,519,Pre-Owned,0,False,
Collins World Atlas: Paperback Edition,569,Pre-Owned,0,True,
Collins World Atlas by Collins Maps,600,Pre-Owned,0,True,
"Atlas of the World , hardcover ,",1359,Pre-Owned,0,False,
"World Atlas by Hammond World Atlas Corporation Staff (1999, Digital, Other,...",704,Pre-Owned,550,False,
New ListingCosmopolitan World Atlas Hardcover Rand McNally Staff,618,Pre-Owned,0,False,
Collins World Atlas: Illustrated Edition - Collins,1899,Brand New,0,False,
National Geographic Collegiate Atlas of the World,518,Pre-Owned,0,False,
Old HAMMOND'S STANDARD WORLD ATLAS Book 1958 COLOR MAPS UNITED STATES EUROPE ++,099,,821,True,
The New Cambridge Modern History Atlas - 319 Pages,295,New (Other),416,False,
antique 1905 Scarborough’s new standard atlas of the world pictures maps book,1250,,500,False,
"Illustrated World Atlas by Reader's Digest Editors (2004, Hardcover)",249,Pre-Owned,876,False,
World of Warcraft Atlas: The Burning Crusade by BradyGames,495,New (Other),483,False,
Collins World Atlas: Paperback Edition - Paperback By Collins Maps - GOOD,439,Pre-Owned,0,True,
Collins World Atlas: Paperback Edition,437,Pre-Owned,0,False,0
"Quick Reference World Atlas; WORLD ATLAS / - paperback, Rand McNally, 0528965719",378,Pre-Owned,0,False,
National Geographic Collegiate Atlas of the World 2nd Edition 9781426208393 book,2008,New (Other),1392,True,
World Atlas of Coral Reefs,600,Pre-Owned,0,True,
Collins World Atlas: Paperback Edition by Collins Maps,849,Pre-Owned,0,False,0
Concise Atlas of World History by Oxford University Press,500,Pre-Owned,0,True,
New ListingThe Reader's Digest Children's World Atlas 1992 Hardcover 128 Pages,719,Pre-Owned,483,False,
Atlas of the World's Religions Hardcover Ninian Smart,683,Pre-Owned,0,False,
Hammond Passport Travelmate and World Atlas ,200,New (Other),349,True,
New Century World Atlas Hardcover Hammond World Atlas Corporation,565,New (Other),0,False,
Atlas of the World Hardcover,1124,Pre-Owned,0,False,
2001 Scholastic Atlas Of The World Book Paperback,700,Pre-Owned,,False,
Satellite World Atlas : Two Stunning Views of Our World by Metrobooks Staff,639,Pre-Owned,751,True,
Family Reference Atlas of the World Hardcover National Geographic,1500,Pre-Owned,891,False,
Shop on eBay,2000,Brand New,,False,
Maps Of The World Hammond Superior Set Of 8 Maps In Booklet ,999,Pre-Owned,416,True,
School Atlas Inter Folia Fructus Annual Issue of 1932 Appleton Philip and Finch ,4073,,495,True,
The Illustrated World Atlas Hardcover,400,Pre-Owned,483,True,
Illustrated World Atlas Hardcover Coffee Table Reader's Digest,1020,Pre-Owned,,True,0
Atlas of the World Hardcover,1124,Pre-Owned,0,False,
2001 Scholastic Atlas Of The World Book Paperback,700,Pre-Owned,,False,
Hammond Atlas of the World Large Hardcover,479,Pre-Owned,600,False,
Goode's World Atlas,500,Pre-Owned,0,True,
The Concise World Atlas of Wine by Hugh Johnson; Jancis Robinson,549,Pre-Owned,0,True,
"Bartholomew Hardcover Mini World Atlas 6""x4""",500,Pre-Owned,450,False,
National Geographic Satellite Atlas of the World (Direct Mail Edition),600,Pre-Owned,0,True,
"The Signet World Atlas: Completely Revised a- 0451197321, B M Willett, paperback",358,Pre-Owned,0,False,
"Essential World Atlas , paperback , Oxford University Press",1036,Pre-Owned,0,False,
Children's World Atlas Book By Malcolm Watson - Ages 5-7 - Paperback,881,Brand New,3998,False,
Historical Atlas of the World Rand McNally 1994 Paperback Book Map Maps Globe,649,Pre-Owned,349,False,
World Atlas Hardcover DK Publishing 1997,1500,New (Other),1085,False,
Vintage Time Hammond World Atlas (1980),300,New (Other),416,False,
The Illustrated World Atlas,433,Pre-Owned,0,False,
"Goode's World Atlas by Rand McNally 17th Edition. (4th printing,  revised 1988)",199,Pre-Owned,483,False,
Hammond Concise Atlas of World History,500,Pre-Owned,0,True,
Geographical Atlas of the World,718,Pre-Owned,0,False,
New Concise World Atlas,684,Pre-Owned,0,True,
Rand McNally Illustrated Atlas of the World (1989) Hardcover,599,Pre-Owned,751,False,
World Atlas American Automobile Association 1992 Deluxe Edition,1499,Pre-Owned,0,False,
New Comparative World Atlas [Hammond Comparative World Atlas]  - Acceptable,412,Pre-Owned,0,False,
Concise World Atlas (Concise Atlas of the World),600,Pre-Owned,0,True,
Hardback Book Funk & Wagnalls Hammond World Atlas,349,Pre-Owned,550,True,
Reader's Digest Atlas of the World by Reader's Digest,510,Pre-Owned,400,True,
New ListingWorld Atlas of Golf Wind Ward Thomas and Price 1976 First US Ed Hardcover Book,659,Pre-Owned,617,False,
Reader's Digest Great World Atlas 1997 Hardcover Illustrated ,1870,Pre-Owned,,True,0
"1992 AAA World Atlas, like new, Pre-owned ",1200,New (Other),617,False,
Reference World Atlas (Dk Reference World Atlas) by DK Publishing (Hardcover),1999,Pre-Owned,0,False,
The New Rand McNally College World Atlas Hardcover,635,Pre-Owned,0,False,
"Complete Atlas of the World, 3rd Edition : The Definitive View of",1289,Pre-Owned,,True,
"The Reader's Digest ""Children's Atlas of the World"" Hardcover Hands on Projects",899,Pre-Owned,,False,
Reader's Digest Illustrated Great World Atlas,800,Pre-Owned,0,True,
Atlas of the World,1264,Pre-Owned,0,False,0
"Atlas of the World, 12th Edition - Press, 0195221478, hardcover",870,Pre-Owned,0,False,
Essential World Atlas - Paperback By Oxford University Press - GOOD,1162,Pre-Owned,0,True,
New ListingThe Times Concise Atlas of the World. Large Hardcover 1979. Slipcover Vintage,3380,Pre-Owned,599,False,
"Reader's Digest Wide World Atlas - hardcover, 0528831488, Association",628,Pre-Owned,0,False,
The Firefly World Atlas Hardcover,562,Pre-Owned,0,False,
Premier World Atlas by Rand McNally Staff 1997 Paperback,175,Pre-Owned,483,False,
Collins World Atlas: Mini Edition by Collins Staff,600,Pre-Owned,0,True,
"New ListingNational Geographic Collegiate Atlas of the World, Second Edition, 40.00",1999,New (Other),0,False,
The Reader's Digest Children's World Atlas - Completely Revised and Updated,900,Pre-Owned,0,False,
Atlas of the World,810,Pre-Owned,0,False,
Reader's Digest atlas of the world by Reader's Digest Editors,600,Pre-Owned,0,True,
Encyclopedic World Atlas by George Philip & Son; Oxford University Press,700,Pre-Owned,0,True,
Readers Digest Wide World Atlas - 4th Printing 1984,1495,Pre-Owned,0,False,
"National Geographic Concise Atlas of the World, Third Edition: The Ultimate...",600,Pre-Owned,0,True,0
"Hammond Ambassador World Atlas - 9780843713824, Hammond World Atlas C, hardcover",448,Pre-Owned,0,False,
Collins Discovery World Atlas  Smithsonian ,419,Pre-Owned,0,False,
Rand McNally Goode's World Atlas Hardcover Joel L. Morrison,450,Pre-Owned,0,False,
"Goode's World Atlas , paperback ,",735,Pre-Owned,0,False,
"Atlas of the World , Oxford University Press ,",1900,Pre-Owned,,False,
National Geographic Atlas of the World Revised Sixth Edition Oversized Book 1992,2488,New (Other),,False,
Compact Atlas of the World: 6th Edition [Compact World Atlas] DK VeryGood,649,Pre-Owned,0,False,
Atlas of the World: Deluxe Edition,959,Pre-Owned,0,False,0
New Concise World Atlas Hardcover Oxford University Press,626,Pre-Owned,0,False,
Concise World Atlas 96  0540072591 Book The Fast Free Shipping,448,Pre-Owned,0,False,
World Atlas of Nations,421,Pre-Owned,0,False,
"Pocket A-Z World Atlas, 7th Edition by DK (Paperback)",100,Pre-Owned,399,False,0
"Cosmopolitan World Atlas - 9780528836749, hardcover, Rand McNally and Company",597,Pre-Owned,0,False,
World Atlas Hardcover DK Publishing,668,Pre-Owned,,True,
New Concise World Atlas,1000,Pre-Owned,0,False,
"Pocket World Atlas - hardcover, 9780195219517, Oxford University Press",499,Pre-Owned,0,False,
Hammond Standard World Atlas Deluxe Edition Hardcover Good,1500,Pre-Owned,0,False,
Mini World Atlas Hardcover,513,Pre-Owned,0,False,
"1962 Edition "" ATLAS OF THE WORLD """,1500,Pre-Owned,650,False,
1994 Rand McNally World Atlas Paperback,439,Pre-Owned,499,True,
"World Atlas of Nations by Rand McNally Staff (1993, Hardcover)",1099,Pre-Owned,0,False,
Essential World Atlas: A Comprehensive Guide to the World Today by DK,649,Pre-Owned,0,False,0
"Reader’s Digest Illustrated Great World Atlas, Large Hardcover, 1997",1500,Pre-Owned,617,True,
Hammond Citation World Atlas Paperback Book,599,Pre-Owned,0,True,
Shop on eBay,2000,Brand New,,False,
 Grest World Atlas Readers Digest Edition 1963 Hardcover 11 x 16 ,2995,Pre-Owned,1185,True,
"National Geographic Atlas of the World, Eighth Edition - Hardcover - GOOD",8857,Pre-Owned,0,True,
"Dorling Kindersley World Atlas - huge book, beautifully illustrated maps mapping",1145,Pre-Owned,4003,False,
The Time Atlas of World History - 1980 Hardcover with Dust Cover,1955,Pre-Owned,684,False,
Atlas of the World : A Millennium Edition Hardcover Rand McNally,626,Pre-Owned,,True,
New ListingHammond Large Type World Atlas by Hammond Inc,2000,Pre-Owned,0,True,
"National Geographic Atlas of the World, Eighth Edition - Hardcover  - VERY NICE!",1274,Pre-Owned,1099,True,
Rand McNally World Atlas by Rand McNally,600,Pre-Owned,0,True,
Atlas Historical World Atlas,449,Pre-Owned,0,False,
Nystrom World Atlas  - Acceptable,412,Pre-Owned,0,False,
Goode's World Atlas,633,Pre-Owned,,False,0
1975 NATIONAL GEOGRAPHIC ATLAS OF THE WORLD BOOK of MAPS Vintage Fourth Edition,2200,New (Other),0,False,
"Illustrated World Atlas by Reader's Digest Editors (2004, Hardcover)",1298,Pre-Owned,0,True,
"‘Philips Great World Atlas’ Hardback Book, Third Edition.",1146,Pre-Owned,3261,False,
Vtg Rare Hard To Find 1965 Rand McNally Historical World Atlas Stonehenge Cover,7900,Pre-Owned,685,False,
The International Atlas : World Longitudes and Latitudes Time Changes and...,2499,Pre-Owned,483,False,
Bartholomew Mini Atlas World,528,Pre-Owned,0,False,
Hammond International World Atlas Hammond Inc,450,Pre-Owned,0,False,
"The New Webster's U. S. & World Atlas, Hardcover",400,New (Other),349,False,
Hammond Scholastic World Atlas,399,Pre-Owned,0,False,
Goode's World Atlas,616,Pre-Owned,,False,0
Essential World Atlas,1053,Pre-Owned,0,False,0
"National Geographic Atlas of the Wo- 087044347X, hardcover, National Geographic",729,Pre-Owned,0,False,
Pocket World Atlas,615,Pre-Owned,0,True,
Illustrated Atlas of the World,419,Pre-Owned,0,False,
National Geographic Atlas of the World Fifth Edition 1981 Hard Cover 12in x 18in,1495,Pre-Owned,795,False,
"Illustrated World Atlas by Reader's Digest; Dolezal, Robert",800,Pre-Owned,0,True,
National Geographic Atlas Of World History Hard Cover Book,1899,New (Other),0,False,
World atlas The Children's Illustrated Courage Books 1993 perham steele R1,922,Pre-Owned,527,True,
"World Atlas; RAND MCNALLY WORLD ATLAS - 0528836986, hardcover, Rand McNally, new",1107,Brand New,0,True,
"THE ILLUSTRATED WORLD ATLAS, B.M. Willett (1987)",1870,Pre-Owned,,True,
Cosmopolitan World Atlas Rand McNally Vintage Map book 1987 Hardcover Countries,2097,Pre-Owned,595,True,
Atlas of the World Hardcover,1216,Pre-Owned,0,False,
World Atlas of Nations by Rand McNally,600,Pre-Owned,0,True,
Vintage Antique Old Very Rare 1976 Hammond Citation World Atlas Book In Color(15,1000,Pre-Owned,550,False,
"World Atlas by Collins Maps (Hardback, 2012)",241,Brand New,1933,False,
Hammond New Contemporary World Atlas Hardcover Hammond Inc,489,Pre-Owned,0,False,
WORLD ATLAS by Rand McNally (Newsweek Edition),759,Pre-Owned,0,False,
Children's World Atlas Book By Malcolm Watson - Ages 5-7 - Paperback,2062,Brand New,4024,False,
National Geographic Atlas Of The World 7th Edition,1235,Pre-Owned,0,False,
Collins World Atlas: Paperback Edition - Paperback By Collins Maps - GOOD,439,Pre-Owned,0,True,
Atlas Historical World Atlas,435,Pre-Owned,0,False,
Today's World Atlas from the Cartographers Rand McNally Maps Large Book,700,Pre-Owned,684,False,
World Geo-Graphic Atlas: A Composite of Man's Environment CCA 1953 Herbert Bayer,59997,Brand New,821,False,
Collegiate Atlas of the World - National Geographic,520,Pre-Owned,550,False,
"Compact Atlas of the World; Compact World - 0756689848, DK Publishing, paperback",357,Pre-Owned,0,False,
Cosmopolitan World Atlas,419,Pre-Owned,0,False,
"National Geographic Atlas of the World, Tenth Edition With Slipcover Very Good",4241,Pre-Owned,961,True,
ATLAS OF THE WORLD 2003 PARAGON Hardcover - Excellent Condition! 256 pages,890,Pre-Owned,499,True,
Atlas of the World - Millennium Edition 1999,1999,Pre-Owned,0,False,
"New Comparative World Atlas - paperback, 9780843708523, Hammond Incorporated",404,Pre-Owned,0,False,
Goode's World Atlas by Rand McNally,1399,Pre-Owned,499,False,
Vintage 1962 Scholastic/Hammond World Atlas Revised Edition EUC,630,Pre-Owned,416,False,
Goode's World Atlas by Rand McNally,500,Pre-Owned,0,True,
Illustrated Great World Atlas Hardcover Reader's Digest Editors,919,Pre-Owned,0,False,
Hammond International World Atlas,489,Pre-Owned,0,False,
National Geographic 1981 Atlas of the World: Fifth Ed Huge Book (b14),1299,Pre-Owned,821,False,
Hammond Atlas of the World - Hardcover By Hammond Incorporated - GOOD,439,Pre-Owned,0,True,
Collins World Atlas: Reference Edition by Collins Maps Book The Fast Free,806,Pre-Owned,0,False,
New Historical Atlas of the World 6th Edition Rand McNally Maps History ,1350,Brand New,425,False,
The Canadian School Atlas HB 1922 Maps  W3,1995,Pre-Owned,0,True,
"World Atlas, The Signet Hammond",560,Pre-Owned,0,False,
"Satellite Atlas of the World - hardcover, Firm, 9780195222043",596,Pre-Owned,0,False,
"Reader's Digest atlas of the world - 0895772647, hardcover, Joseph L Gardner",515,Pre-Owned,0,False,
New ListingTHE NEW STANDARD ENCYCLOPEDIA AND WORLD ATLAS 1932 HB BOOK,2166,Pre-Owned,4410,False,
Atlas Historical World Atlas,535,Pre-Owned,,False,0
Hammond Citation World Atlas: Deluxe Edition,598,Pre-Owned,0,False,0
"Rand McNally Goode's World Atlas - 9780528843365, J Paul Goode, hardcover",919,Pre-Owned,0,False,
"National Geographic Compact Atlas of the World, Second Edition",559,Pre-Owned,,False,0
The New Comparative World Atlas,536,Pre-Owned,0,False,
The World Book Great Geographical Atlas 1982,1288,Pre-Owned,617,False,
Hammond Concise Atlas of World History [  ] Used - VeryGood,471,Pre-Owned,,True,
"Hammond World Atlas, Sixth Edition (2010, HCDJ) VG",1250,Pre-Owned,891,True,0
"Bartholomew's Illustrated Atlas of the World - Readers Digest, 1994, Hardcover",1198,Pre-Owned,416,False,
Readers Digest Illustrated Great World Atlas ,999,Pre-Owned,699,True,
Shop on eBay,2000,Brand New,,False,
"Bartholomew's Illustrated Atlas of the World - Readers Digest, 1994, Hardcover",1198,Pre-Owned,416,False,
Readers Digest Illustrated Great World Atlas ,999,Pre-Owned,699,True,
"The World Atlas of Archaeology by Michael Wood (1986, Hardcover)",1067,Pre-Owned,801,True,0
Atlas of the World (Oxford Atlas of the World),9285,Pre-Owned,0,True,
"Hammond World Atlas, Sixth Edition (2010, HCDJ) VG",1250,Pre-Owned,891,True,0
The Penguin State of the World Atlas: Ninth Edition,449,Pre-Owned,0,False,0
New Listing10x BP Esso Michelin Worldwide USA Europe Ordnance Survey old Maps Bundle Joblot,1718,Pre-Owned,2064,False,
"Essential World Atlas by  , paperback",518,Pre-Owned,0,True,
National Geographic Atlas of the World   - by National Geographic,10595,Pre-Owned,399,False,
Atlas of the World,945,Pre-Owned,0,False,
"Hammond large type world atlas - 9780816147014, hardcover, Hammond Incorporated",699,Pre-Owned,0,True,
Collins Student World Atlas  Collins Student Atlas ,419,Pre-Owned,0,False,
Rand McNally Concise World Atlas by Rand McNally,600,Pre-Owned,0,True,
"World History Atlas - 9780756609672, hardcover, DK Publishing",744,Pre-Owned,0,False,
The Comparative World Atlas (Hammond Comparative World Atlas) - Paperback - GOOD,448,Pre-Owned,0,True,
Geographical Publishing 1959 School & Library World Atlas Frameable Color Maps ,7499,Pre-Owned,1311,True,
Atlas of the World  10th Edition,768,Pre-Owned,0,False,
Essential World Atlas,469,Pre-Owned,0,False,
"Hammond Ambassador World Atlas - hardcover, 0843712422, Hammond Inc",523,Pre-Owned,0,False,
Hammond World Atlas,469,Pre-Owned,0,False,
The New York Times Atlas of the World: In Collaboration With the Times of London,1899,Pre-Owned,684,False,
"Atlas of the World, 12th Edition",927,Pre-Owned,0,True,
"National Geographic Concise Atlas of the World by Society, National",500,Pre-Owned,0,True,
The New Websters Library of Practical Information (U.S. and World Atlas) W3,800,Pre-Owned,399,True,
Premier World Atlas,590,Pre-Owned,0,True,
1989 Newsweek Hammond Paperback World Atlas,899,Pre-Owned,636,False,
New Concise World Atlas,714,Pre-Owned,0,True,0
"Rand McNally World Atlas ,",623,Pre-Owned,0,True,
Readers Digest Atlas Of The World Rand McNally Maps,999,Pre-Owned,699,True,
VTG 1939 Collier's World Atlas and Gazetteer Book,4600,,899,False,
Hammon Comparative World Atlas Revised Edition,899,Pre-Owned,349,False,
World Book Atlas Hardcover World Book 1992 Revised Edition Maps Globe Geography,2624,Pre-Owned,550,True,
Concise Atlas of World History  - Good,518,Pre-Owned,0,False,
Philip's World Atlas: Paperback Edition by Philip's Maps Hardback Book The Fast,448,Pre-Owned,0,False,
Concise Atlas of the World by George Philip & Son,600,Pre-Owned,0,True,
The Penguin Atlas of Women in the World  - paperback,365,Pre-Owned,0,True,
New Atlas World History: Global Events - Haywood - Combined Shipping Discount,099,Pre-Owned,751,False,
"RAND MCNALLY Illustrated Atlas of Today's World, Volume 1 (hardcover 1962)",299,Pre-Owned,275,False,
New World Loose Leaf Atlas c. 1929 monumental leather atlas 100+ maps,42500,,2495,False,
"World Atlas of Wine - hardcover, Hugh Johnson, 1845333012, new",2169,Brand New,0,False,
"National Geographic Visual Atlas of the World: More Than 1,000 Stunning Maps, Il",1188,Pre-Owned,,False,0
Standard Atlas & Chronological History of the World 1912 Charles Leonard-Stuart,2000,Pre-Owned,0,True,
1969 Hammond world Atlas collector's edition leather bound,790,Pre-Owned,550,False,
DK Millennium World Atlas: A Portrait of the Earth in the Year 2000,814,Pre-Owned,0,False,
Citation World Atlas,647,Pre-Owned,0,False,
New ListingRand McNally Quick Reference World Atlas Rand McNally Paperback Used - Good,899,Pre-Owned,399,True,
World Atlas of Coral Reefs,600,Pre-Owned,0,True,
National Geographic Atlas of the World by U. S. National Geographic Society...,2550,Pre-Owned,891,False,
The Times Atlas of the World,630,Pre-Owned,0,False,
Atlas of the World,1500,Pre-Owned,0,False,
The Travel Atlas [Lonely Planet],886,Pre-Owned,,False,0
National Geographic Atlas Of World History HardCover Book 1997 Leather Deluxe Ed,1799,Pre-Owned,0,False,
Concise Atlas of the World Hardcover DK Publishing,499,Pre-Owned,550,False,
Hammond Citation World Atlas: Deluxe Edition,628,Pre-Owned,0,False,
"Collins World Atlas: Paperback Edition by , Good Book",423,Pre-Owned,0,False,
"Complete Atlas of the World, 4th Edition: Classic Mapping for the Modern World D",2163,Pre-Owned,0,False,
World Atlas by Rand McNally Hardback Book The Fast Free Shipping,551,Pre-Owned,0,False,
National Geographic Collegiate Atlas of the World Hardcover Natio,587,Pre-Owned,0,False,
Atlas of the World: Deluxe Edition,4067,Pre-Owned,0,True,
Philip's World Atlas by Philip's Maps Hardback Book The Fast Free Shipping,506,Pre-Owned,0,False,
Vintage Encyclopedia Britannica World Atlas Unbridged Hardcover 1952,999,Pre-Owned,990,False,
Collins World Atlas: Essential Edition (Collins Essential Edi... by Collins Maps,937,Pre-Owned,0,False,
The Ideal Reference Atlas of the World With Historical Maps C.S. Hammond 1936 HC,2999,Pre-Owned,416,True,
"Bartholomew Mini World Atlas by John Bartholomew & Son; Bartholomew, John",500,Pre-Owned,0,True,
Goode's World Atlas,559,Pre-Owned,,False,0
"Pocket Atlas of the World , Paperback , Haack, Hermann",495,Pre-Owned,0,False,
THE HAMMOND UNIVERSAL WORLD ATLAS ~ Hammond Inc ~ 1988 ~ VG+,1300,Pre-Owned,700,False,
Citation World Atlas,519,Pre-Owned,0,False,
Collins Mini Atlas of the World by Collins,399,Pre-Owned,0,True,
Compact Atlas of the World: 6th Edition (Compact World Atlas) By DK - VERY GOOD,428,Pre-Owned,0,True,
Rand McNally Atlas of the World: A millennium edition - Hardcover - GOOD,615,Pre-Owned,0,True,0
National Geographic Atlas Of The World 7th Edition Hardcover With Dust Jacket,1000,Pre-Owned,814,False,
National Geographic Atlas of the World. - Hardcover - W/supplementals And Key,950,Pre-Owned,891,False,
Reader's Digest Atlas of the World by Reader's Digest Editors 1987,784,Pre-Owned,999,True,0
"Atlas of the World New Edition (Hardcover, New York Times, 1985)",995,Pre-Owned,667,True,0
